,Unnamed: 0.4,Unnamed: 0.3,Unnamed: 0.2,Unnamed: 0.1,Unnamed: 0,judul,link,isi
115,10.0,,,,,"Rapat Bareng DPR, Menteri UMKM Pamer KUR Sektor Produksi Cetak Rekor",https://finance.detik.com/moneter/d-8214909/rapat-bareng-dpr-menteri-umkm-pamer-kur-sektor-produksi-cetak-rekor,"Jakarta
-
Menteri Usaha Mikro Kecil dan Menengah (UMKM) Maman Abdurrahman menghadiri rapat kerja bersama komisi VII DPR hari ini. Dalam kesempatan tersebut, Maman membeberkan sejumlah pencapaian program Kredit Usaha Rakyat (KUR).
Berdasarkan hasil rapat komite kebijakan pembiayaan bagi UMKM, ditetapkan alokasi plafon KUR pada 2025 mencapai Rp 286,61 triliun dengan target debitur baru sebanyak 2,34 juta debitur, 1,17 juta debitur yang graduasi, serta disalurkan ke sektor produksi sebesar 60%.
Per 15 November 2025, Maman membeberkan nilai penyaluran KUR mencapai Rp 238,7 triliun atau setara 83,2% dari target dengan jumlah debitur mencapai 4 juta debitur. Adapun jumlah debitur graduasi mencapai 1,32 juta atau setara 112% serta debitur baru mencapai 2,25 juta atau setara 96,38%.
""Kami Kementerian UMKM ingin sedikit ya agak mau menyombong sedikit lah kalau Pak Menteri Keuangan Pak Purbaya pede, Kalau kita pede sesuai fakta juga, kita agak sedikit pamer juga dengan temen-temen komisi VII,"" ujar Maman di Gedung DPR RI, Jakarta Pusat, Senin (17/11/2025).
Pengumuman! Bunga KUR Flat 6%-Pengajuan Dibebaskan Mulai 2026
Penyaluran sektor produksi, Maman menyebut mencapai 60,7%. Maman menerangkan realisasi ini melampaui target sekaligus penyaluran KUR ke sektor produksi yang paling tinggi sejak program tersebut berjalan.
""Saya ingin menyampaikan tahun 2020 kita hanya sampai pada 54% yg dialokasikan ke sektor produksi, tahun 2021 kurang lebih turun ke bawah. Tahun 2022 sekitar 56%, tahun 2023 kurang lebih 56% juga, tahun 2024 (mencapai) 57%,"" tambah Maman.
Ia optimistis penyaluran KUR ke sektor produksi mencapai 61% hingga akhir tahun nanti. ""Alhamdulilah sepanjang sejarah berdirinya program KUR inilah pertama kali capai target yang sudah sesuai dengan ditargetkan ke sektor produksi yaitu 60,7%,"" jelas Maman.
sektor produksi
umkm
maman abdurrahman
kur
pembiayaan umkm"
116,11.0,,,,,"Purbaya Mau Daur Ulang Baju Impor Bekas Sitaan, Menteri UMKM Respons Begini",https://finance.detik.com/berita-ekonomi-bisnis/d-8214609/purbaya-mau-daur-ulang-baju-impor-bekas-sitaan-menteri-umkm-respons-begini,"Jakarta
-
Menteri Usaha Mikro Kecil dan Menengah (UMKM) Maman Abdurrahman menanggapi terkait rencana Menteri Keuangan (Menkeu) Purbaya Yudhi Sadewa ingin mendaur ulang pakaian bekas impor ilegal yang telah disita. Maman mengatakan pemerintah masih mengkaji rencana tersebut.
Maman mengatakan setiap langkah yang diambil pemerintah akan komprehensif sekaligus memprioritaskan melindungi pengusaha dalam negeri.
""Oh iya, semua kan akan kita, pokoknya tadi saya bilang solusi langkahnya akan komprehensif. Dan yang terpenting adalah bagaimana bisa melindungi produsen-produsen dalam negeri kita. Itu yang paling utama,"" ujar Maman dalam konferensi pers di kantor Kemendag, Jakarta Pusat, Senin (17/11/2025),
Maman menekankan fokus pemerintah dalam hal menertibkan barang impor ilegal, termasuk baju bekas demi kepentingan usaha dalam negeri. Menurut Maman, setiap pilihan yang muncul ke depannya, seperti mendaur ulang pakaian bekas impor akan dikoordinasikan lebih lanjut.
Baju Impor Bekas Bakal Didaur Ulang, Begini Rencana Purbaya
""Kalau baju cacahan kan tentunya nanti outputnya ke baju-baju daur ulang kan, ke barang-barang daur ulang. Nah itu semua nanti sudah kita akan kita koordinasikan,"" terang Maman.
Sebelumnya, Purbaya punya rencana untuk mendaur ulang pakaian impor bekas sitaan pemerintah. Selama ini pakaian bekas impor cukup memakan banyak biaya untuk dimusnahkan, per kontainer saja mencapai Rp 12 juta ongkosnya. Maka dari itu opsi mendaur ulang jadi opsi baru untuk menangani barang sitaan tersebut.
Purbaya mengaku sudah sempat berkonsultasi dengan Presiden Prabowo Subianto soal rencana daur ulang pakaian impor bekas sitaan, katanya Prabowo mendukung rencananya tersebut.
""Ini juga atas arahan Presiden. Mesti dimanfaatkan, jangan dibakar begitu saja. Kita pikir-pikir gimana, 'Pak, boleh nggak kalau kita cacah ulang?' Boleh katanya,"" kata Purbaya saat jumpa pers di kantornya, Jakarta Pusat, Jumat (14/11/2025) yang lalu.
Purbaya langsung menemui Asosiasi Garmen dan Tekstil Indonesia (AGTI) untuk memaparkan rencananya itu. Para pengusaha pun setuju dengan rencana Purbaya, AGTI dan para anggotanya akan mencacah ulang pakaian impor bekas untuk kemudian bisa digunakan kembali
Tonton juga video ""Kini Thrifting di e-Commerce Sudah Dilarang!""
pakaian bekas
baju impor
purbaya yudhi sadewa
menteri umkm
kebijakan pemerintah"
117,24.0,,,,,"Produk Impor Tanpa Label Serbu Pasar Domestik, Menteri UMKM Buka Suara",https://finance.detik.com/berita-ekonomi-bisnis/d-8214468/produk-impor-tanpa-label-serbu-pasar-domestik-menteri-umkm-buka-suara,"Jakarta
-
Menteri Usaha Mikro Kecil dan Menengah (UMKM) Maman Abdurrahman akan menindaklanjuti terkait derasnya pakaian impor murah asal China yang masuk ke pasar dalam negeri. Pembahasan ini sudah ditindaklanjuti bersama lintas kementerian, termasuk pembahasan mengenai serbuan pakaian impor tanpa merek.
""Mengenai barang-barang impor dari China yang masuk ke Indonesia, tadi sudah kita bicarakan secara detail, secara intensif, dan kami sepakat bahwa nanti dari tim teknis akan menindaklanjuti pertemuan kita,"" ujar Maman saat konferensi pers di Kantor Kementerian Perdagangan, Jakarta Pusat, Senin (17/11/2025).
Maman menegaskan pemerintah tidak hanya akan menertibkan barang-barang impor baju bekas. Namun, juga akan memperketat barang impor dari China yang disebut menghantam UMKM.
""Tapi yang produk-produk barang impor dari China yang menghantam atau mengkanibalisasi produk-produk UMKM kita yang memproduksi dalam negeri juga akan kita tindaklanjuti dan akan kita amankan,"" terang Maman.
Dagangan Thrifting Bakal Diganti Produk Lokal, 1.300 Merek Sudah Disiapkan
Kendati begitu, Maman tidak menerangkan terkait rencana atau kebijakan apa yang akan diambil pemerintah selanjutnya. Ia hanya memastikan akan menindaklanjuti lebih lanjut.
""Detailnya nanti akan kita bicarakan di tim kita. Secara prinsip yang penting ini juga sudah menjadi arahan dari Pak Presiden, tentunya kita akan tindaklanjuti,"" imbuhia.
Sebelumnya, Produk impor tanpa merek dapat dengan mudah melenggang masuk dan beredar di marketplace hingga mal. Sebagian besar produk tersebut datang dari China, Vietnam, India, hingga Malaysia.
Direktur Eksekutif Asosiasi Pertekstilan Indonesia (API), Danang Girindrawardana mengatakan China dan Vietnam dikenal sebagai produsen tekstil dan garmen terbesar di dunia. Ketika menghadapi hambatan dagang dengan Amerika Serikat, negara-negara tersebut menghadapi stok berlebih (overstock). Kemudian menyalurkannya ke pasar-pasar dengan pengawasan longgar, termasuk Indonesia.
Menurut Danang, barang-barang itu tidak selalu masuk langsung dari negara asal. Sebagian besar dikirim melalui negara transhipment seperti Kuala Lumpur dan Singapura agar lolos pengawasan bea cukai.
""Memang kebanyakan dari China ya, China atau Vietnam ya. Mereka juga melalui negara transhipment yang lain. Negara transhipment yang lain misalnya Kuala Lumpur atau Singapura melalui pelabuhan-pelabuhan itu,"" ujar Danang kepada
detikcom
, Rabu (29/10/2025)
Tonton juga video ""Produsen Serat dan Filamen RI Gantungkan Harapan Ke Purbaya Soal Serangan Impor Garmen""
pakaian murah
maman abdurrahman
umkm indonesia
pasar domestik"
118,25.0,,,,,"Bayar Pajak Kendaraan Semudah Beli Pulsa, Begini Prosesnya",https://oto.detik.com/berita/d-8214064/bayar-pajak-kendaraan-semudah-beli-pulsa-begini-prosesnya,"Jakarta
-
Bayar pajak kendaraan bisa semudah beli pulsa. Memang seperti apa prosesnya?
Korlantas Polri terus meningkatkan pelayanan untuk memudahkan masyarakat, salah satunya saat melakukan pembayaran pajak kendaraan. Kakorlantas Polri Irjen Pol Agus Suryonugroho menekankan bahwa pihak kepolisian terus berupaya menyederhanakan sistem pembayaran pajak kendaraan bermotor. Dia bilang membayar pajak kendaraan itu semudah membeli pulsa.
Pajak Motor Mati-Tak Dibayar 2 Tahun Berturut-turut, Awas Nggak Bisa Dipakai Jalan Lagi
""Hari ini kita punya semangat yang sama bahwa bagaimana membayar pajak itu semudah dengan membeli pulsa. Ini semangat pelayanan secara intergrated Samsat termasuk juga penegakan hukum yang sudah bertransformasi dengan ETLE. Jadi 95% penegakan hukum dengan ETLE dan 5% penegakan hukum dengan tilang manual,"" jelas Agus dilansir laman Korlantas Polri.
Pembayaran pajak kendaraan sekarang memang kian mudah. Bisa dilakukan di manapun sambil duduk manis tanpa perlu keluar rumah dan repot antre di kantor Samsat. Bukan cuma itu, kamu juga nggak perlu repot fotokopi dokumen apapun.
Soalnya semuanya sudah digital dan terintegrasi. Terpenting kamu sudah memiliki aplikasi Signal untuk mengurus pembayaran pajak tersebut. Namun perlu dicatat, pembayaran pajak secara online ini hanya bisa dilakukan untuk pajak tahunan ya! Untuk pajak lima tahunan, kamu tetap harus pergi ke kantor Samsat sebab ada proses cek fisik sekaligus cetak STNK dan pelat nomor baru.
Semua proses dilakukan lewat aplikasi. Kamu juga bakal diberikan opsi bisa mengambil STNK di kantor Samsat atau dikirim ke rumah Bila diambil ke kantor Samsat, maka tak ada biaya pengiriman yang dibebankan.
Namun demikian bila dikirim ke rumah, ada dua opsi pengiriman yang ditawarkan. Pertama adalah reguler dan express. Kami saat itu memilih opsi express dan dikenakan biaya sekitar Rp 30.500. Bila yang dipilih opsi reguler, biaya pengirimannya lebih rendah yaitu Rp 20.000.
Prosesnya pun terbilang cepat. Dari perpanjangan hingga STNK dikirim ke rumah, hanya sekitar 3 hari. Kemudian setelah STNK diterima, kamu bisa melakukan pengesahan di aplikasi. Ini berbeda dengan proses perpanjangan STNK di Samsat karena pemilik kendaraan dapat bukti pengesahan berupa stiker.
Bayar Pajak STNK Bisa Online, Wajib Ada KTP Asli!
Tapi kamu tak perlu khawatir, karena STNK tetap dinyatakan sah. Ketika ada pemeriksaan di jalan, pemilik kendaraan hanya perlu menunjukkan bukti elektronik pengesahan di aplikasi. Kalau nggak mau ribet, kamu bisa mencetak QR code dari pengesahan STNK di aplikasi dan menempelnya di kolom pengesahan STNK.
""Jangan khawatir jika kamu tidak mendapatkan stiker pengesahan. Saat ini stiker hologram atau stempel bentuk pengesahan diganti menjadi QR Code yang terdapat pada e-Pengesahan di aplikasi Signal sehingga kamu tidak perlu lagi ke Samsat,"" demikian dikutip laman Instagram Samsat Digital.
Video: Kakorlantas Sebut E-TLE Catat Peningkatan Penegakan Hukum Lalu Lintas
Video: Kakorlantas Sebut E-TLE Catat Peningkatan Penegakan Hukum Lalu Lintas
bayar pajak kendaraan
pajak kendaraan online
aplikasi signal
korlantas polri
proses pembayaran pajak
stnk digital
layanan samsat"
119,77.0,,,,,Pengajuan KUR sampai Rp 100 Juta Tanpa Agunan!,https://finance.detik.com/moneter/d-8215189/pengajuan-kur-sampai-rp-100-juta-tanpa-agunan,"Jakarta
-
Menteri Usaha Mikro Kecil dan Menengah (UMKM) Maman Abdurrahman menegaskan Kredit Usaha Rakyat (KUR) dengan plafon sampai Rp 100 juta tidak memakai agunan.
Penegasan ini menjawab keluhan sejumlah anggota DPD (Dewan Perwakilan Daerah) soal permintaan jaminan oleh oknum bank penyalur KUR.
""Saya tegaskan sekali lagi ya, pengajuan KUR dari Rp 1 juta- Rp 100 juta tanpa agunan sama sekali,"" ujar Maman usai Rapat Koordinasi Komite Kebijakan KUR di Kementerian Koordinator Bidang Perekonomian, Jakarta Pusat, Senin (17/11/2025).
Maman mengakui masih ada beberapa kasus permintaan agunan oleh oknum petugas di lapangan. Ia menekankan aturan pemerintah sangat jelas dan tidak memberikan ruang bagi praktik tersebut.
""Bahwa memang masih ada 1, 2, 3, 4, 5, 6, 7, 8 kejadian yang mungkin oknum-oknum di lapangan masih meminta agunan, memang kita harus akui masih ada. Tetapi yang harus dipahami bahwa tegas kok secara aturan,"" tuturnya.
Maman meminta masyarakat maupun para pemangku kepentingan termasuk DPR/DPD untuk melapor jika menemukan pelanggaran. Pemerintah, menurutnya, siap menindak tegas bank penyalur yang terbukti melanggar aturan.
""Kalau memang ternyata masih ada laporan, silakan berikan laporan resmi pada kami. Kami pasti akan tindak lanjuti dan akan berikan sanksi. Sanksinya itu tidak dibayarkan subsidi KUR-nya kepada bank terkait. Itu tegas sekali,"" tegas Maman.
Dia mengatakan sudah ada beberapa bank yang dikenakan sanksi atas praktik tersebut. ""Banyak, sudah ada beberapa kok,"" ujarnya.
Untuk memperkuat pengawasan dan memudahkan masyarakat melapor, Kementerian UMKM akan meluncurkan sistem pelaporan terintegrasi bernama Sapa UMKM pada Desember 2025. Platform ini dirancang agar pelaku UMKM di seluruh Indonesia dapat menyampaikan pengaduan terkait KUR secara mudah dan terpusat.
""Nanti semuanya itu akan kita full di situ. Jadi laporan-laporan dari saudara-saudara kita, usaha mikro, kecil, menengah, itu kita akan full-kan semua laporannya di situ. Jadi terintegrasi semua,"" jelas Maman.
Selama ini laporan masih bersifat konvensional dan menyulitkan pelaku UMKM di wilayah terpencil. Melalui Sapa UMKM, pemerintah berharap seluruh laporan dapat tercatat secara real time dan langsung ditindaklanjuti.
""Saya mohon maaf kepada publik, ini baru terealisasi Desember. Jadi Insya Allah nanti setelah Desember, semuanya, saudara-saudara kita yang ada di ujung sana, dia akan bisa lapor ke Sapa UMKM,"" ujar Maman.
kredit usaha rakyat
kur tanpa agunan
kur 2021
umkm
maman abdurrahman"
120,78.0,,,,,Komisi XI Cecar Anak Buah Purbaya soal Lesunya Bursa Karbon RI,https://finance.detik.com/bursa-dan-valas/d-8215056/komisi-xi-cecar-anak-buah-purbaya-soal-lesunya-bursa-karbon-ri,"Jakarta
-
Dewan Perwakilan Rakyat (DPR) RI mempertanyakan potensi pasar karbon Indonesia. Pasalnya, proyek karbon Indonesia yang tercatat masih sangat sedikit. Berdasarkan data Bursa Efek Indonesia (BEI), baru ada empat proyek Bursa Karbon (IDXCarbon).
Ketua Komisi XI DPR RI, Mukhamad Misbakhun, menjelaskan saat ini Bursa Karbon baru laku Rp 78 miliar sejak peluncurannya pada 2023. Selain itu, pembeli jasa Bursa Karbon masih didominasi oleh pelaku usaha di sektor Pembangkit Listrik Tenaga Uap (PLTU).
""Perkembangan bursa karbonnya sampai sekarang, seperti yang tadi dijelaskan, baru menyangkut jumlah yang, ya, kita mau bagaimana juga baru tingkatannya sekitar Rp 78 miliar, Rp 78 miliar, dan apakah ini sesuai dengan ekspektasi? Dan yang pembayar pajaknya pun rata-rata masih dalam lingkup PLTU,"" ungkap Misbakhun dalam Rapat Dengar Pendapat (RDP) bersama jajaran Kementerian Keuangan di Kompleks Parlemen, Senayan, Jakarta Pusat, Senin (17/11/2025).
Menteri LH: Bursa Karbon RI Mulai Bergeliat, Capai Rp 78,5 Miliar
Ia mempertanyakan efektivitas kebijakan tersebut. Pasalnya, terdapat narasi yang menyebut pajak karbon justru membebani biaya energi dan ekonomi makro. ""Ini kalau menurut saya yang penjelasan lebih lanjutnya, kenapa ketika kita memilih kebijakan ini justru menjadi beban kepada ekonomi,"" jelasnya.
Dalam kesempatan yang sama, Anggota Komisi XI DPR RI, Thoriq Majiddanor, mempertanyakan langkah konkret dari adanya Bursa Karbon dan pajak karbon. Di sisi lain, ia juga mempertanyakan mekanisme pembayaran pajak bagi perusahaan pembeli kredit karbon di Bursa. Ia menilai, harga karbon domestik masih sangat rendah.
""Bagaimana mekanisme sinkronisasi (pajak karbon) dengan perdagangan karbon? Misalnya, dapatkah pelaku menggunakan kredit karbon dari IDX karbon untuk mengkompensasi kewajiban pajak karbonnya? Kemudian, harga karbon domestik juga masih sangat rendah, Rp 60.000 per ton. Kemudian, apakah pemerintah berencana meningkatkan
for price
pajak karbon di atas Rp 30 per kilogram seiring berjalannya waktu?,"" jelasnya.
Menteri LH Ungkap Bursa Karbon RI Mulai Dilirik di KTT COP30 Brasil
Kritik tentang Bursa Karbon dan penerapan pajak karbon juga disampaikan Anggota Komisi XI DPR, Musthofa, yang menyebut pasar karbon di Indonesia masih sangat minim. Padahal, pajak karbon sendiri telah diatur dalam Undang-Undang (UU) Nomor 7 Tahun 2021 tentang Harmonisasi Peraturan Perpajakan (UU HPP).
""Faktanya, mulai dari tahun 2023 hingga tahun 2025 ini masih minimalis. Karena masih minimalis ini tentu kan tidak sesuai dengan harapan kita bersama. Sehingga ketika undang-undang itu sudah disahkan dalam pelaksanaannya tidak sesuai, ini upaya yang harus dilakukan apa? Untuk percepatan mengejar ini,"" jelasnya.
Perdagangan Karbon Dibuka Internasional
Sementara itu, Direktur Jenderal Strategi Ekonomi dan Fiskal Kementerian Keuangan, Febrio Nathan Kacaribu, mengaku pemerintah mendorong keterjangkauan Bursa Karbon. Ia menyebut, perdagangan karbon ini telah dibuka secara internasional pada awal 2025.
Ia menjelaskan, terdapat empat proyek Bursa Karbon di Indonesia. Pertama, PT Pertamina Power Indonesia dengan proyek pembangkit terbarukan geothermal di Lahendong. Kedua, PT PLN Nusantara Power dengan proyek PLTGU di Muara Karang Blok 3, konversi Pembangkit Combined Cycle di Muara Tawar, dan proyek Pembangkit Listrik Baru Berbahan Bakar Gas Bumi PLTMG Sumbagut 2 Peaker.
Ketiga, PT PLN Indonesia Power dengan proyek Pembangkit Listrik Tenaga Air Minihidro (PLTM) di Gunung Wugul, PLTGU Priok, dan konversi Pembangkit Combined Cycle (Add On) PLTGU di Grati. Terakhir, PT Perkebunan Nusantara IV dengan proyek pemanfaatan limbah pabrik kelapa sawit (POME) untuk biogas co-firing.
Uang di Bursa Saham RI Meledak! Nilainya Tembus 4 Kali APBN
Ia menjelaskan, Indonesia memiliki potensi besar Bursa Karbon. Hal ini tercermin dengan luasan lahan hutan yang dimiliki Indonesia. ""Kita ingin agar
carbon credit
yang tercipta dari kawasan hutan Indonesia dapat dievaluasi dengan baik oleh global dan harapannya ini nanti bisa menggunakan mekanisme Bursa Karbon yang sudah ada,"" jelasnya.
Ia menambahkan, terkait pajak karbon pihaknya telah menerapkan tarif. Ia menjelaskan, pajak karbon ini menjadi dasar untuk mendukung perdagangan di Bursa. Namun begitu, ia menyebut
roadmap
pajak karbon akan membebani perekonomian.
""Potensi dampak pajak karbon yang akan negatif terhadap ekonomi makro, risiko kenaikan biaya energi, seperti misalnya kita simulasikan dengan BPP listrik dan bahan bakar fosil, ini sudah jelas. Nah justru disini kita akan menghitung supaya kredit yang diperjualbelikan di pasar karbon itu dapat mengkompensasi tambahan biaya yang diakibatkan oleh usaha kita menurunkan emisi,"" pungkasnya.
bursa karbon
dpr ri
pajak karbon
kementerian keuangan"
121,81.0,,,,,Terbesar! Pertamina Setor Rp 23 Triliun ke Danantara,https://finance.detik.com/energi/d-8215029/terbesar-pertamina-setor-rp-23-triliun-ke-danantara,"Jakarta
-
PT Pertamina (Persero) menjadi BUMN dengan sumbangan dividen terbesar ke Danantara. Hingga September 2025 Pertamina telah menyetorkan dividen sebesar Rp 23 triliun dari total Rp 42,21 triliun atas kinerja tahun buku 2024.
Hal ini diungkapkan oleh Wakil Direktur Utama (Wadirut) PT Pertamina (Persero) Oki Muraza dalam Rapat Dengar Pendapat (DPR), Senin (17/11/2025).
""Dalam hal dividen, Pertamina juga memberikan dividen terbesar untuk Danantara dengan total dividen sebesar Rp 42,1 triliun atas kinerja tahun buku 2024. Di mana sampai bulan September 2025 ini sudah disetorkan Rp 23 triliun dari total dividen Pertamina,"" katanya.
Selain dividen, Oki juga menyampaikan Pertamina juga menjadi BUMN penyumbang pajak terbesar bagi negara. Dimana hingga September pajak yang telah disetorkan Pertamina sebesar Rp 159,2 triliun.
Danantara Pertimbangkan Investasi Rp 21,7 T ke Proyek Pipa Gas-Tol Yordania
Hingga September 2025 sumbangan Pertamina ke ngera sudah mencapai Rp 262 triliun.
""Penerimaan negara dari Pertamina terjaga di atas Rp 300 triliun rupiah per tahun dengan porsi terbesar berasal dari pajak, di mana Pertamina adalah salah satu BUMN penyumbang pajak terbesar di Indonesia,"" katanya.
""Ini tentunya menegaskan kembali komitmen Pertamina dalam memberikan nilai lebih bagi negara sekaligus menjaga keberlanjutan bisnis di tengah tekanan dan dinamika global,"" tambahnya.
pertamina
danantara
bumn
dividen
pajak
sumbangan negara
kinerja keuangan
investasi
rp 23 triliun
keberlanjutan bisnis"
122,86.0,,,,,Biang Kerok Banyak Bank Masih Tarik Agunan untuk KUR di Bawah Rp 100 Juta,https://finance.detik.com/moneter/d-8215240/biang-kerok-banyak-bank-masih-tarik-agunan-untuk-kur-di-bawah-rp-100-juta,"Jakarta
-
Menteri Usaha Mikro, Kecil dan Menengah (UMKM) Maman Abdurrahman buka suara terkait masih banyaknya pengajuan Kredit Usaha Rakyat (KUR) di bawah Rp 100 juta yang dimintai agunan oleh beberapa bank. Padahal menurut Permenko Perekonomian Nomor 1 Tahun 2023, pengajuan KUR di bawah Rp 100 juta tidak membutuhkan agunan tambahan.
Menurutnya, penyebab utama masalah ini terletak pada bagaimana secara psikologis perbankan harus tetap berhati-hati dalam memberikan pinjaman guna memastikan debitur mampu dan mau mengembalikan kreditnya. Sebab tak sedikit debitur yang menyepelekan pembayaran pinjaman atau kreditnya karena tidak ada agunan.
""Petugas di lapangan mereka sadar, mereka tahu bahwa angka Rp 1-100 juta tidak boleh dimintakan agunan. Karyawan-karyawan bank penyalur dari BRI, Mandiri, BNI, sampai yang bank swasta semua tahu dan sadar sekali itu. Mereka tahu itu. Tetapi yang jadi permasalahan adalah mereka butuh moral obligasi,"" kata Maman dalam Rapat Kerja dengan Komisi VII DPR RI, Jakarta Pusat, Senin (17/11/2025).
""Itu semata-mata hanya untuk melakukan ya mungkin verifikasi atau tekanan psikologis kepada pihak debitur agar tidak terjadi moral hazard. Agar jangan sampai mereka itu menganggap sepele urusan utang piutang dengan pihak bank ini,"" sambung Maman.
Pengajuan KUR sampai Rp 100 Juta Tanpa Agunan!
Kondisi inilah yang menurut Maman memaksa perbankan tetap meminta syarat administrasi lebih atau agunan agar bisa menekan dibitur tertentu untuk tetap membayarkan kreditnya secara berkala. Walau tentu metode ini tak digunakan kepada semua debitur.
""Nah ini biasanya terjadi kepada individu-individu yang mungkin membuat pihak karyawan bank di lapangan mungkin dia kurang punya trust terhadap si A atau si B. Itu satu. Lalu yang kedua, kenapa susah lagi, yang kedua terkait SLIK,"" ucapnya.
Meski begitu, Maman menegaskan pihaknya selaku regulator tetap melarang perbankan untuk meminta agunan untuk pengajuan KUR di bawah Rp 100 juta apapun alasannya. Untuk itu, Kementerian yang dipimpinnya terus melaksanakan fungsi pengawasan kepada para pemberi pinjaman.
""Tetapi walau apapun itu, kami dari Kementerian UMKM karena memang ini sudah aturan, kita nggak akan mungkin keluar dari situ. Jadi kita tetap melakukan monitoring dan evaluasi yang namanya angka Rp 1-100 juta tidak boleh dimintakan agunan,"" terangnya.
Jika benar kedapatan perbankan tetap meminta agunan untuk pengajuan KUR di bawah Rp 100 juta, Maman menegaskan pihaknya akan memberikan sanks berupaya pembatalan pembayaran subsidi bunga kepada bank.
""Angka 1-100 juta, saya pastikan 100% sampai hari ini Kementerian UMKM masih konsisten melakukan monitoring, evaluasi, bahkan banyak juga yang kita berikan sanksi. Apa sanksinya? Sanksi administratif bahwa itu tidak dicairkan angka subsidinya,"" tegas Maman.
kredit usaha rakyat
kur
agunan
perbankan"
123,89.0,,,,,Pendapatan Pertamina Diproyeksikan Tembus Rp 1.127 Triliun,https://finance.detik.com/energi/d-8215011/pendapatan-pertamina-diproyeksikan-tembus-rp-1-127-triliun,"Jakarta
-
Kinerja keuangan Pertamina tetap positif di tengah tekanan ekonomi global. Hingga akhir 2025, diproyeksikan pendapatan Pertamina mencapai US$ 68 miliar atau sekitar Rp 1.127 triliun.
Tren positif ini ditopang oleh langkah efisiensi, respon cepat, dan continuous improvement di seluruh lini operasi Pertamina. Selain itu, seluruh program strategis Pertamina dirancang selaras dengan Asta Cita Presiden Prabowo Subianto terutama dalam memperkuat swasembada energi melalui penerapan dual growth strategi yakni Maximizing Legacy Business dan Building Low Carbon Business.
""Di tahun 2025 diproyeksikan akan membukukan pendapatan sebesar US$ 68 miliar atau setara dengan Rp 1.127 triliun dengan capaian laba bersih US$ 3,3 miliar atau setara dengan Rp 54 triliun,"" ujar Direktur Utama PT Pertamina (Persero) Simon Aloysius Mantiri dalam Rapat Dengar Pendapat dengan Komisi XII DPR RI, Senin (17/11/2025).
Dari sisi operasional, produksi migas Pertamina tetap terjaga di level lebih dari 1 juta BOEPD. Terkait dengan kinerja kilang Pertamina, Simon mengatakan produksi kilang yield valuable berada pada rekor tertinggi pada level lebih dari 83%.
""Capaian ini menunjukkan improvement bukan hanya jargon, tetapi komitmen pertamina dalam menjaga ketahan energi dan memberi nilai terbaik nagi Indonesia menuju Indonesia emas tahun 2045,"" terang Simon.
Selain itu, Simon juga memaparkan kontribusi Pertamina kepada negara sudah mencapai Rp 262 triliun hingga September 2025 yang berasal dari pajak, PNBP, dan dividen.
""Ini menjadikan Pertamina sebagai agen pembangunan utama melalui penerimaan pajak, non pajak dan dividen terbesar Indonesia,"" katanya.
Volume penjualan BBM dan produk lainnya juga terus menunjukkan tren stabil, dengan total penjualan menembus lebih dari 100 juta KL.
""Volume niaga gas tetap stabil dikisaran 300 juta MMBTU, volume pengangkutan kargo Pertamina Internasional Shipping tumbuh sekitar 8%, dan produksi listrik kami untuk tahun 2025 diproyeksikan mencapai 8,4 GWh melebihi target RKAP yang kami tetapkan,"" jelas Simon.
kinerja keuangan
pertamina
pendapatan 2025
efisiensi operasional
swasembada energi
dual growth strategy
produksi migas
kontribusi negara
bbm
energi terbarukan"
