,Unnamed: 0.4,Unnamed: 0.3,Unnamed: 0.2,Unnamed: 0.1,Unnamed: 0,judul,link,isi
40,40.0,40.0,40.0,40.0,53.0,Judol Picu Mutilasi Sadis Istri Pegawai Pajak Asal Blitar di Manokwari,https://www.detik.com/jatim/hukum-dan-kriminal/d-8209972/judol-picu-mutilasi-sadis-istri-pegawai-pajak-asal-blitar-di-manokwari,"Surabaya
-
Seorang wanita asal Blitar yang bekerja dan tinggal bersama suaminya di Manokwari, Papua Barat, menjadi korban pembunuhan sadis.
Korban bernama Aresty Gunar Tinarda (38) dibunuh hingga dimutilasi oleh buruh bangunan yang tengah merenovasi rumahnya. Kasus ini memicu keprihatinan setelah terungkap bahwa pelaku menghabisi korban karena terlilit utang judi online (judol).
Pria bernama Yahya Himawan (29) membunuh dan memutilasi Aresty, istri seorang pegawai Kantor Pelayanan Pajak (KPP) Pratama Manokwari. Yahya sendiri merupakan buruh bangunan yang mengerjakan renovasi rumah korban. Dia sudah sempat menerima gaji atas pekerjaannya pada Minggu (9/11).
Babak Belur Pelaku Mutilasi Istri Pegawai Pajak Asal Blitar di Manokwari
""Tersangka mendapatkan upah kerja dari pemilik rumah yang sedang tersangka kerjakan, mendapatkan upah rehab sebesar Rp 3.300.000,"" ujar Kapolresta Manokwari Kombes Ongky Isgunawan kepada wartawan, Kamis (13/11/2025).
Yahya kemudian menggunakan gaji yang baru diterimanya untuk bermain judi slot. Sialnya, Yahya kalah besar akibat bermain judi online.
""Uang itu habis,"" ungkap Ongky.
Pelaku yang kalah judi online mulai berpikir melakukan perampokan, hingga mendatangi rumah korban di kawasan Reremi Puncak, Manokwari pada Senin (10/11). Menurut Ongky, pelaku sejak awal mengetahui bahwa korban Aresty sedang seorang diri di rumahnya.
Mayat Istri Pegawai Pajak di Manokwari Ternyata Juga Dimutilasi
Setibanya di lokasi, pelaku langsung mendesak korban untuk memberikan uang namun korban menolak. Saat itulah pelaku langsung menganiaya korban.
""Pelaku menganiaya korban dengan cara menusuk di bagian dada, memukul dan menutup mulut korban hingga meninggal dunia,"" tutur Ongky.
Jasad korban selanjutnya dimasukkan ke dalam boks kontainer plastik berwarna pink. Pelaku lalu menggunakan telepon genggam milik korban untuk memesan jasa mobil angkut barang.
""Sebelum meninggalkan rumah, pelaku sempat membersihkan lokasi kejadian agar tampak seolah tidak terjadi apa-apa,"" tuturnya.
Jasad Korban Dibuang ke Septic Tank
Kombes Ongky mengatakan, pelaku membawa boks kontainer berisi tubuh korban ke sebuah rumah kosong di belakang Karaoke Melodika, kawasan Reremi Puncak. Di lokasi itulah pelaku membuang mayat korban ke dalam septic tank.
""Di tempat itu, tersangka membuang tubuh korban ke dalam septic tank, lalu menutup dan mengecor bagian atasnya untuk menghilangkan jejak,"" ungkap Ongky.
Pelaku juga membakar barang bukti boks kontainer yang digunakan untuk mengangkut korban.
Sementara itu, Kasat Reskrim Polresta Manokwari AKP Agung Gumara Samosir mengungkapkan bahwa pelaku sempat memutilasi tubuh korban menjadi tiga bagian sebelum membuangnya.
""Ya, benar, pelaku memutilasi dan jelas itu dilakukan setelah korban dibawa dari rumah korban tempat kejadian perkara (TKP) 1, menuju rumah kosong TKP 2,"" kata AKP Agung Gumara Samosir.
""Untuk dipotongnya itu berdasarkan hasil visum RSUD dan dibantu oleh Rumah Sakit Bayangkara itu ditemukan korban dipotong menjadi tiga bagian, dipotong dari pangkal paha, kaki, jadi dibagi tiga bagian,"" tegasnya.
Motif Penculik dan Pemutilasi Istri Pegawai Pajak Asal Blitar di Manokwari
Pelaku Sempat Minta Tebusan Rp 10 Juta
Yahya rupanya juga sempat menghubungi suami korban untuk meminta uang tebusan.
""Ya itu benar (pelaku minta uang tebusan) senilai Rp 10 juta. Jadi setelah melakukan pembunuhan, pelaku menguasai handphone milik korban,"" kata AKP Agung Gumara.
Namun permintaan itu tidak dipenuhi oleh suami korban. Suami korban kemudian melapor ke polisi setelah sempat berbincang dengan pelaku lewat telepon.
""Tentu saja kan kita mendampingi suaminya. Pada saat itu tentunya suaminya merespons (saat dihubungi pelaku), menanyakan keberadaan istrinya,"" ucap Agung.
Polisi lalu melakukan penyelidikan hingga menangkap pelaku kurang dari 24 jam. Pelaku kemudian diminta menunjukkan lokasi keberadaan korban yang sudah dibuang ke septic tank.
Atas perbuatannya pelaku dijerat Pasal 340 KUHP juncto Pasal 338 KUHP serta Pasal 365 ayat 3 KUHP. Pelaku terancam hukuman mati atau penjara seumur hidup.
Berita ini sudah tayang di detikSulsel, baca berita selengkapnya
di sini
!"
41,41.0,41.0,41.0,41.0,54.0,Lima BUMN Gandeng DJP untuk Kembangkan UMKM,https://finance.detik.com/foto-bisnis/d-4282558/lima-bumn-gandeng-djp-untuk-kembangkan-umkm,"Jakarta
- Direkorat Jenderal Pajak (DJP) Kemenkeu menjalin kerjasama dengan 5 BUMN dalam rangka mendorong dan mengembangkan kualitas dan pelaku UMKM di Indonesia."
42,42.0,42.0,42.0,42.0,55.0,"Pajak Motor Mati-Tak Dibayar 2 Tahun Berturut-turut, Awas Nggak Bisa Dipakai Jalan Lagi",https://oto.detik.com/motor/d-8210004/pajak-motor-mati-tak-dibayar-2-tahun-berturut-turut-awas-nggak-bisa-dipakai-jalan-lagi,"Jakarta
-
Pajak motor yang mati dan tak dibayar dua tahun berturut-turut setelahnya bisa bikin data registrasinya dihapus. Kalau data registrasi dihapus, awas motor kamu nggak bisa dipakai lagi di jalan.
Pajak motor dibayarkan setiap tahun. Selanjutnya setiap lima tahun sekali dilakukan perpanjangan. Kalau tak diperpanjang 5 tahunan, ya pajaknya mati. Kalau pajaknya mati, untuk bisa membuatnya aktif lagi tentu harus dibayar. Pajak yang tak dibayar itu berisiko membuat data STNK kamu dihapus. Khususnya bila pajaknya tak dibayar dua tahun berturut-turut setelah mati.
Akal-akalan Pengendara Mobil Mewah Nunggak Pajak, Ditilang Ajak Damai
Dilihat detikOto dalam sebuah poster di laman Bapenda Jabar, dijelaskan bagi kendaraan bermotor yang tak melakukan registrasi ulang selama dua tahun setelah habis masa berlaku STNK, maka datanya akan dihapus.
""Maka dapat dihapus dari daftar regident ranmor sesuai ketentuang Undang-undang no.22 tahun 2009,"" demikian penjelasan di poster tersebut.
Perihal penghapusan data kendaraan yang STNK-nya mati dua tahun itu memang sudah tertulis di Undang-Undang No. 22 Tahun 2009, tepatnya pada pasal 74 ayat 2. Dalam pasal itu dijelaskan kondisi penghapusan data kendaraan berdasarkan pertimbangan pejabat yang berwenang melaksanakan registrasi kendaraan bermotor.
""Penghapusan registrasi dan identifikasi Kendaraan Bermotor sebagaimana dimaksud pada ayat (1) huruf b dapat dilakukan jika:
a. Kendaraan bermotor rusak berat sehingga tidak dapat dioperasikan, atau
b. pemilik kendaraan bermotor tidak melakukan registrasi ulang sekurang-kurangnya dua tahun setelah habis masa berlaku Surat Tanda Nomor Kendaraan Bermotor,"" begitu bunyi pasalnya.
Pemutihan Pajak Kendaraan Jakarta 2025 Berlaku sampai Kapan?
Jangan menyepelekan ya, sebab data yang sudah dihapus itu tak bisa diregistrasikan kembali. Artinya motor kamu tak bisa digunakan di jalan.
""Yang berakibat kendaraan bermotor tidak dapat dioperasikan,"" begitu penjelasannya lagi.
Penghapusan data kendaraan ini juga tercantum dalam Perpol 7 tahun 2021 tentang Registrasi dan Identifikasi Kendaraan Bermotor BAB VIII tentang Penghapusan dan Pemblokiran Regident Ranmor. Pada pasal 84 ayat 5 disebutkan bahwa penghapusan data kendaraan dari daftar registrasi dan identifikasi kendaraan tidak berlaku apabila kendaraan diblokir, dalam proses lelang, atau kendaraan rusak berat masih dalam perbaikan berdasarkan surat keterangan dari bengkel.
Video: Tarif Baru Pajak Progresif Kendaraan di Jakarta, Berlaku Mulai Hari Ini
Video: Tarif Baru Pajak Progresif Kendaraan di Jakarta, Berlaku Mulai Hari Ini
pajak motor
pajak kendaraan
stnk mati
registrasi kendaraan
penghapusan data kendaraan
undang-undang no. 22 tahun 2009
pajak tak dibayar"
43,43.0,43.0,43.0,43.0,56.0,"Bidik Sumber-sumber Pajak Baru, Pemkab Klungkung Siapkan Satgas",https://www.detik.com/bali/berita/d-8208344/bidik-sumber-sumber-pajak-baru-pemkab-klungkung-siapkan-satgas,"Klungkung
-
Wakil Bupati (Wabup) Klungkung, Tjokorda Gde Surya Putra, mengungkapkan Pemerintah Kabupaten (Pemkab) Klungkung tengah menyiapkan Satuan Tugas (Satgas) Optimalisasi Pajak. Hal ini untuk mengatasi belum optimalnya pengelolaan potensi Pendapatan Asli Daerah (PAD) baru khususnya dari sektor pariwisata seperti pemungutan pajak hotel dan restoran, parkir, dan aset daerah.
""Satgas akan menuntaskan pendataan wajib pajak hotel dan restoran. Selain juga sudah menggunakan aplikasi SMARGOV dan CETAR untuk pelayanan pemutakhiran data objek dan subjek PBB (Pajak Bumi dan Bangunan) termasuk pajak hotel dan restoran,"" jelas Tjok Suryasaat menanggapi pertanyaan dan masukan dari seluruh fraksi dalam Pembahasan Rancangan Anggaran Pendapatan dan Belanja Daerah (RAPBD) di ruang sidang DPRD Klungkung, Rabu (12/11/2025).
Juara Stunting Terendah Nasional, Klungkung dan Gianyar Raih Insentif Rp 5,6 M
Dia juga menepis adanya duplikasi program di antara organisasi perangkat daerah (OPD) sehingga membuat serapan anggaran tidak optimal. Menurut Tjok Surya, program yang sama merupakan program penunjang urusan pemerintah daerah yang terpasang di semua OPD untuk menunjang operasional perangkat daerah.
Surya membeberkan program prioritas tahun depan. Yakni, mendorong pertumbuhan UMKM dan koperasi berupa program pengawasan dan pemeriksaan koperasi, program penilaian kesehatan KSP/USP Koperasi, serta program pendidikan dan latihan perkoperasian. Kemudian, program pemberdayaan dan perlindungan koperasi, program pemberdayaan usaha menengah, usaha kecil dan usaha mikro (UMKM), hingga pengembangan UMKM.
Lalu, untuk pertanian berkelanjutan, ada program penyediaan dan pengembangan sarana pertanian, program
penyediaan dan pengembangan prasarana pertanian, program pengendalian hewan dan kesehatan masyarakat veteriner, hingga program penyuluhan pertanian.
Pemkab Klungkung Diminta Perkuat Pajak dan Retribusi di RAPBD 2026
""Terima kasih atas masukannya, kami akan mencari terobosan untuk meningkatkan PAD. Juga kami akan lebih cermat dalam penganggaran Silpa dengan mencermati laporan keuangan Tahun Anggaran 2025,"" ujar Tjok Surya.
Tjok Surya juga menjamin kepastian hukum terhadap investor yang berinvestasi di Klungkung. Sebab, telah ada Peraturan Daerah Nomor 2 Tahun 2025 tentang Pemberian Insentif dan Kemudahan Investasi. Aturan itu diharapkan mampu mendorong peran serta masyarakat dan sektor swasta dalam pembangunan daerah.
Video: Asri Welas Ngaku Didatangi Orang Pajak gegara Disebut Aktris Termahal
Video: Asri Welas Ngaku Didatangi Orang Pajak gegara Disebut Aktris Termahal
klungkung
pajak
investasi
pad
umkm
pariwisata
satgas"
44,44.0,44.0,44.0,44.0,57.0,"KPP Mampang Prapatan Gelar Pesta Rakyat, Dorong UMKM Naik Kelas",https://finance.detik.com/berita-ekonomi-bisnis/d-8208316/kpp-mampang-prapatan-gelar-pesta-rakyat-dorong-umkm-naik-kelas,"Jakarta
-
Kantor Pelayanan Pajak (KPP) Pratama Mampang Prapatan turut mendorong pelaku UMKM naik kelas. Komitmen tersebut terwujud dalam acara Pesta Rakyat Djampang yang melibatkan 60 UMKM.
Kepala Kantor Wilayah DJP Jakarta Selatan I, Dionysius Lucas Hendrawan, menyebut acara ini bagian dari program Business Development Service (BDS) yang digelar sebagai wadah pembinaan UMKM secara tahunan oleh DJP. Ia menjelaskan, program BDS ini digelar secara bergilir di KPP lainnya.
""Pembinaan UMKM kami lakukan setiap tahun, dan kebetulan sekarang ini kita lakukan di KPP Pratama Mampang, dan sebenarnya memang ini akan bergiliran terus dan KPP-KPP yang lain yang ada di kami, terutama untuk KPP Pratama. Nanti bisa nanti mengelola UMKM-UMKM yang ada di sekitar wilayah mereka,"" ungkapnya di KPP Pratama Mampang Prapatan, Jakarta Selatan, Kamis (13/11/2025).
Sistem Pajak RI Dinilai Rapuh, Ini Penyebabnya
Acara ini bekerja sama dengan Pemerintah Kota (Pemkot) dan Pemerintah Provinsi (Pemprov) DKI Jakarta. Selain itu, DJP juga menggandeng sejumlah BUMD seperti Jakpro hingga perbankan BUMN seperti PT Bank Mandiri (Persero) Tbk dan PT Bank Syariah Indonesia Tbk (BSI).
""Kami juga bekerja sama dengan perbankan-perbankan juga, seperti BSI, juga Mandiri yang berkaitan dengan permodalan yang nanti untuk bisa membantu para UMKM untuk bisa mendapatkan permodalannya,"" jelas.
Dionysius menambahkan, pihaknya juga memberikan pelatihan bagi UMKM seperti literasi keuangan, hak dan kewajiban perpajakan, hingga memfasilitasi UMKM menerima sertifikasi halal.
""Kami bekerja sama juga dengan halal center, di situ bisa mendapatkan sertifikasi halal bagi produk-produk yang sekarang ini dikelola UMKM. Nah ini rencana kami yang kita lakukan dan itu setiap tahun kita lakukan adalah untuk membuat para UMKM itu nanti bisa naik kelas,"" pungkasnya.
Dalam kesempatan yang sama, Wakil Camat Mampang, Rafli Sofyan, menyebut ada 60 UMKM yang terlibat dalam acara ini. Melalui gelaran ini, ia berharap UMKM di wilayah naik kelas.
""Kegiatan ini akan tetap berlanjut, berlangsung seperti yang disampaikan tadi, kita pengin agar UMKM di Kecamatan Mampang Prapatan bisa naik kelas,"" imbuhnya.
Tonton juga video ""InJourney Pesta Rakyat Hadir untuk Merayakan 80 Tahun Indonesia Merdeka""
pesta rakyat
umkm
kpp mampang prapatan"
45,45.0,45.0,45.0,45.0,58.0,Tragis Istri Pegawai Pajak Manokwari Dibunuh-Dikubur di Septic Tank,https://www.detik.com/sulsel/hukum-dan-kriminal/d-8208112/tragis-istri-pegawai-pajak-manokwari-dibunuh-dikubur-di-septic-tank,"Manokwari
-
Pria bernama Yahya Himawan (29) di Kabupaten Manokwari, Papua Barat, membunuh wanita bernama Aresty Gunar Tinarda (38). Pelaku kemudian mengubur mayat istri pegawai Kantor Pelayanan Pajak (KPP) Pratama Manokwari itu ke dalam
septic tank
sebuah rumah kosong.
Pembunuhan sadis itu terjadi di rumah korban di kawasan Reremi Puncak, Manokwari, pada Senin (10/11). Saat itu, pelaku datang ke rumah korban untuk meminta sejumlah uang karena terlilit utang akibat judi online.
""Pelaku diketahui bernama Yahya Himawan yang nekat menghabisi korban lantaran terlilit utang akibat Judol,"" ujar Kapolresta Manokwari Kombes Ongky Isgunawan kepada
detikcom
, Rabu (12/11/2025).
Ongky mengatakan korban menolak memberikan uang ke pelaku. Hal itu diduga membuat pelaku emosi dan langsung menganiaya korban hingga meninggal dunia.
""Pelaku kemudian menganiaya korban dengan cara menusuk di bagian dada, memukul dan menutup mulut korban hingga meninggal dunia,"" katanya.
Pembunuh Istri Pegawai Pajak di Manokwari Pernah Kerja di Rumah Korban
Setelah memastikan korban tidak bernyawa, pelaku memasukkan jasad korban ke dalam kontainer plastik berwarna pink. Pelaku lalu menggunakan telepon genggam korban untuk memesan jasa mobil angkut barang.
""Sebelum meninggalkan rumah, pelaku sempat membersihkan lokasi kejadian agar tampak seolah tidak terjadi apa-apa. Pelaku kemudian membawa kontainer berisi tubuh korban ke lokasi kedua, yakni sebuah rumah kosong di belakang Karaoke Melodika, kawasan Reremi Puncak,"" bebernya.
Pelaku kemudian membuang tubuh korban ke dalam septic tank dan mengecor bagian atasnya untuk menghilangkan jejak. Pelaku juga membakar barang bukti box kontainer yang digunakan untuk mengangkut korban.
""Tim gabungan sempat melakukan pengejaran setelah mengetahui keberadaan tersangka, namun Yahya sempat melarikan diri. Upaya pencarian kemudian melibatkan anjing pelacak dari Polda Papua Barat,"" jelasnya.
Awal Mula Istri Pegawai Pajak Manokwari Ditemukan di Septic Tank Usai Dibunuh
Pelaku Ditangkap di Inggramui
Polisi akhirnya menangkap pelaku di wilayah Kampung Inggramui pada Selasa (11/11). Pelaku kemudian dibawa ke lokasi kedua untuk menunjukkan tempat korban dikubur yang berjarak sekitar 300 meter dari rumah korban.
""Setelah dilakukan pembongkaran
septic tank
, jasad korban berhasil ditemukan dalam kondisi mengenaskan, dengan tubuh terbagi menjadi tiga bagian,"" katanya.
Dalam pengungkapan kasus ini, Polresta Manokwari mengamankan sejumlah barang bukti berupa baju yang digunakan tersangka, handphone korban, dompet, tas ransel, laptop, pisau, sangkur, mobil pick up, linggis, cangkul dan baju korban. Ia memastikan penyidik masih mendalami motif lain serta menelusuri kemungkinan keterlibatan pihak lain dalam kasus ini.
""Atas perbuatannya Pelaku kini ditahan di Polresta Manokwari dan dijerat Pasal 340 KUHP (pembunuhan berencana), Pasal 338 KUHP (pembunuhan) dan Pasal 365 ayat (3) KUHP (pencurian dengan kekerasan) dengan ancaman hukuman mati atau penjara seumur hidup,"" tutupnya.
Terlilit Utang Judol Bikin Pria di Manokwari Tega Bunuh Istri Pegawai Pajak
Pelaku Pernah Kerja di Rumah Korban
Kabag Ops Polresta Manokwari Kompol Wisnu Prasetyo mengatakan pelaku merupakan buruh bangunan. Dari hasil pemeriksaan diketahui, pelaku pernah bekerja di rumah korban.
""Dari hasil penyelidikan awal, diketahui bahwa pelaku bekerja sebagai buruh bangunan dan pernah bekerja di rumah korban beberapa waktu lalu,"" kata Kompol Wisnu kepada wartawan, Selasa (11/11).
Dia menambahkan bahwa sejauh ini hanya Yahya yang ditetapkan sebagai tersangka. Meski demikian, tidak menutup kemungkinan ada tersangka lain seiring berjalannya proses pemeriksaan terhadap Yahya.
""Saat ini, pelaku berstatus tersangka tunggal, sementara penyidik masih mendalami kemungkinan adanya pihak lain yang terlibat,"" pungkasnya."
46,46.0,46.0,46.0,46.0,59.0,"Mau Ikut Pemutihan Pajak Kendaraan Jakarta, Wajib ke Samsat?",https://oto.detik.com/berita/d-8208172/mau-ikut-pemutihan-pajak-kendaraan-jakarta-wajib-ke-samsat,"Jakarta
-
Mau ikutan pemutihan pajak kendaraan di Jakarta, perlukah datang ke Samsat?
Pemerintah Provinsi DKI Jakarta tengah menggelar program pemutihan denda pajak kendaraan. Pemutihan ini berlangsung pada 10 November hingga 31 Desember 2025. Buat yang mau ikutan, kamu akan dibebaskan dari membayar sanksi denda berupa bunga keterlambatan.
Pemutihan Pajak Kendaraan di Jakarta, Biaya Ini yang Bakal Dihapus
Pemutihan denda pajak kendaraan ini bisa dilakukan tanpa harus mengajukan permohonan. Dikutip laman Bapenda Jakarta, pembebasan sanksi dilakukan secara otomatis (by system) melalui sistem Pajak Online milik Bapenda.
Nah untuk mengikuti program pemutihan ini, kamu juga tak perlu repot datang ke Samsat. Sebab, dendanya sudah dihapuskan melalui sistem, maka kamu juga bisa ikutan lewat aplikasi Signal. Mekanismenya seperti pembayaran pajak tahunan lewat online.
""Kami ingin masyarakat merasa terbantu. Pajak daerah yang dibayarkan akan kembali untuk pembangunan dan kesejahteraan warga Jakarta,"" terang Kepala Bapenda DKI Jakarta, Lusiana Herawati dalam siaran persnya.
Dengan demikian, setiap Wajib Pajak yang menyelesaikan pembayaran pokok pajaknya dalam jangka waktu 10 November-31 Desember 2025 akan otomatis memperoleh pembebasan bunga keterlambatan, tanpa perlu melakukan langkah tambahan apa pun. Jadi, mulai tanggal tersebut, sistem pajak online Bapenda akan langsung menyesuaikan dan menghapus sanksi administratif bagi Wajib Pajak yang memenuhi ketentuan.
Ada Pemutihan Denda Pajak Kendaraan di Jakarta, Ini Syaratnya
Pemutihan ini tentu memberi keringanan bagi para wajib pajak yang nunggak. Tak cuma itu, pemutihan ini juga bertujuan untuk:
Mendorong kepatuhan pajak di kalangan masyarakat;
Mempermudah proses administrasi pembayaran pajak kendaraan;
Mengoptimalkan penerimaan daerah dengan memberikan kesempatan bagi masyarakat untuk menuntaskan kewajiban tanpa beban tambahan bunga;
Menciptakan sistem pelayanan pajak daerah yang lebih efisien dan transparan.
""Ini adalah langkah kami untuk membantu masyarakat, sekaligus mendorong kesadaran pajak dan tertib administrasi kendaraan bermotor di Jakarta,"" ujar Lusiana.
Video: Siap-siap! Penjual Online Bakal Kena Pajak, Segini yang Dibayar
Video: Siap-siap! Penjual Online Bakal Kena Pajak, Segini yang Dibayar
pemutihan pajak kendaraan
samsat jakarta
denda pajak
bapenda dki jakarta
pajak online"
47,47.0,47.0,47.0,47.0,60.0,Milenial hingga Gen-Z Jadi Motor Penggerak Baru UMKM di Sukabumi,https://www.detik.com/jabar/berita/d-8209268/milenial-hingga-gen-z-jadi-motor-penggerak-baru-umkm-di-sukabumi,"Sukabumi
-
Dinas Koperasi Usaha Kecil dan Menengah (DKUKM) Kabupaten Sukabumi mulai menyiapkan regenerasi pelaku usaha muda untuk memperkuat ekosistem ekonomi lokal.
Langkah ini menjadi bagian dari strategi pembinaan berkelanjutan agar dunia usaha di daerah tetap hidup, relevan, dan adaptif terhadap perkembangan teknologi.
Disperkim Sukabumi Pakai Peta Digital agar Bantuan Tepat Sasaran
Pemerintah daerah menilai, kehadiran generasi muda sangat penting dalam mendorong transformasi sektor usaha kecil. Mereka memiliki keunggulan dalam inovasi, adaptasi digital, dan keberanian mengambil risiko bisnis baru. Melalui pelatihan kewirausahaan dan pendampingan, DKUKM berupaya menghadirkan ruang pembelajaran yang mendorong tumbuhnya pelaku UMKM dari kalangan milenial dan Gen Z.
""Kami melihat potensi besar dari anak-anak muda Sukabumi. Mereka lebih cepat beradaptasi dengan dunia digital dan punya banyak ide segar. Tugas kami adalah memastikan mereka mendapat dukungan pembinaan yang tepat agar bisa tumbuh menjadi pelaku usaha baru yang tangguh,"" ungkap Sri Hastuty Harahap, Kepala DKUKM Kabupaten Sukabumi, dalam keterangan tertulis.
Selain pelatihan dasar usaha, program regenerasi ini juga diarahkan pada penguatan kapasitas teknis seperti manajemen keuangan, pengemasan produk, dan strategi pemasaran digital. Setiap peserta didorong untuk memahami rantai nilai usaha sejak tahap produksi hingga distribusi, agar mampu mengembangkan bisnis yang berkelanjutan.
Tuty menambahkan, pembinaan pelaku muda juga melibatkan jejaring antarinstansi, dunia pendidikan, dan lembaga permodalan. Kolaborasi ini memungkinkan anak muda tidak hanya mendapat pelatihan, tetapi juga akses modal dan pendampingan usaha.
Sampah Menggunung di Bandung, DLH Jabar Soroti soal Pengelolaan Sampah
""Kami ingin membangun ekosistem wirausaha muda yang benar-benar hidup. Bukan sekadar pelatihan sesaat, tapi proses yang berkelanjutan, di mana mereka bisa terus belajar, berkembang, dan berkontribusi bagi ekonomi daerah,"" ujar Tuty.
Langkah ini sejalan dengan visi DKUKM untuk menghadirkan UMKM tangguh dan koperasi berkualitas melalui pembinaan lintas generasi. Dengan regenerasi pelaku usaha, Sukabumi diharapkan dapat melahirkan wirausahawan muda yang membawa wajah baru bagi sektor UMKM.
Video: 19 Orang Tewas dalam Demo Gen Z di Nepal Tolak Pemblokiran Medsos
Video: 19 Orang Tewas dalam Demo Gen Z di Nepal Tolak Pemblokiran Medsos
umkm
milenial
gen-z
sukabumi
berita jabar
jawa barat"
48,48.0,48.0,48.0,48.0,61.0,Menteri UMKM Siap Luncurkan Aplikasi 'Sapa UMKM' Bagi Pelaku Usaha Kecil,https://news.detik.com/berita/d-8206569/menteri-umkm-siap-luncurkan-aplikasi-sapa-umkm-bagi-pelaku-usaha-kecil,"Jakarta
-
Menteri Usaha Mikro Kecil Menengah (UMKM)
Maman Abdurrahman
mengatakan pihaknya siap meluncurkan aplikasi 'Sapa UMKM' dalam waktu dekat. Maman mengatakan aplikasi ini nantinya akan terintegrasi ke seluruh pelaku UMKM di Indonesia.
""Kita konsolidasikan, kita kumpulkan menjadi satu wadah yang namanya 'Sapa UMKM', sebuah sistem terintegrasi. Jadi pokoknya semua saudara-saudara kita yang mau tahu tentang usaha mikro, usaha kecil-menengah, mau tahu tentang akses pembiayaan, mau
dapetin
fasilitas a, b, dan c, semua kita
kumpulin
menjadi satu di sini,"" kata Maman dalam wawancara
Jejak Pradana
yang tayang di
detikcom
, Senin (10/11/2025).
Setahun Pemerintahan Prabowo, Menteri UMKM Ungkap Capaian KUR Produksi 60%
Maman mengatakan nantinya aplikasi ini akan memonitor para pelaku UMKM di setiap paginya. Pemerintah, katanya, akan memberikan informasi dan pesan-pesan semangat.
""Jadi akhirnya kita memonitor mereka minimal setiap pagi misalnya atau setiap dua hari misalnya kita pemerintah bisa memberikan informasi kepada mereka 'hai pengusaha-pengusaha mikro, tetap semangat ya, kalau kamu mau mengakses tentang pembiayaan, datang ke sini' minimal informasi,"" ujar Maman.
Maman menyebutkan aplikasi ini akan diluncurkan paling telat akhir Desember 2025. Dia menyebut aplikasi ini juga akan terintegrasi dengan Badan Penyelenggara Jaminan Produk Halal (BPJPH).
""Kita insyaallah paling telat akhir Desember, saya lagi mengupayakan ke pertengahan-pertengahan Desember biar ya
soft launching
dulu, tapi fase pertama, fase sempurnanya nanti di 3 bulan pertama di tahun 2026. Karena ternyata, setelah saya pikir-pikir, nggak mudah juga membangun sistem ini karena ini bukan cuma aplikasi biasa karena terintegrasi dia ke BPJPH,"" ujar Maman.
Jejak Pradana
adalah potret dedikasi setahun pertama untuk negeri. Talk show inspiratif ini akan menghadirkan pemangku kepentingan dari pemerintah maupun swasta yang berdedikasi memajukan negeri dalam setahun terakhir. Saksikan konten lengkapnya di
detik.com/jejak-pradana
.
Komisi VI DPR soal Thrifting Dilarang: UMKM Harus Naik Kelas"
